Key,English,German,Swedish,Lithuanian,Latvian
ExamIntro,"Welcome to the Exam Mode!
Now is the time to put theory into real practice!
Imagine the real life situation and follow all the necessary steps.

Please be aware that all your actions give you a score at the end of the lesson.","Willkommen im Prüfungsmodus!
Jetzt ist es an der Zeit, Theorie in echte Praxis umzusetzen!
Stell dir die wirkliche Lebenssituation vor und befolg alle notwendigen Schritte.

Bitte beachte, dass alle Handlungen am Ende der Lektion eine Punktzahl ergeben.","Välkommen till examensläget!
Nu är det dags att sätta teori i verklig praxis!
Föreställ dig den verkliga situationen och följ alla nödvändiga steg.

Observera att alla dina handlingar ger dig en poäng i slutet av lektionen.","Sveiki atvykę į egzamino režimą!
Dabar pats laikas pažvelgti į realią praktiką!
Įsivaizduokite tikrąją gyvenimo situaciją ir atlikite visus būtinus veiksmus.

Atminkite, kad visi jūsų veiksmai suteikia rezultatą pamokos pabaigoje.","Laipni lūdzam eksāmena režīmā!
Tagad ir laiks teoriju ieviest reālā praksē!
Iedomājieties reālās dzīves situāciju un izpildiet visus nepieciešamos pasākumus.

Lūdzu, ņemiet vērā, ka visas jūsu darbības sniedz jums rezultātu stundas beigās."
ExamPerfect,Well done! You've completed the training perfectly!,Gut gemacht! Du hast das Training perfekt abgeschlossen!,Bra gjort! Du har slutfört utbildningen perfekt!,Šauniai padirbėta! Puikiai baigėte mokymą!,Labi padarīts! Jūs esat lieliski pabeidzis apmācību!
ExamAverage,"You can do better than this, let's try once again!","Das kannst du noch besser, versuchen wir es noch einmal!","Du kan göra bättre än detta, låt oss försöka återigen!","Galite padaryti geriau nei tai, pabandykime dar kartą!","Jūs varat labāk, mēģināsim vēlreiz!"
ExamPoor,That seemed difficult and challenging! Please try again!,Das schien schwierig und herausfordernd! Bitte versuche es erneut!,Det verkade svårt och utmanande! Var god försök igen!,"Tai atrodė sunku ir sudėtinga! Prašau, pabandykite dar kartą!",Tas šķita grūti un izaicinoši! Mēģiniet vēlreiz!
CongratsExam,Congratulations!,Herzlichen Glückwunsch!,Grattis!,Sveikiname!,Apsveicam!